{
  "$schema": "https://cips.cardano.org/cips/cipXXXX/schemas/assurance-v2.json",
  "preamble": {
    "title": "Guessing game — draft interface migration (not checked)",
    "description": "Proposed metadata layout. The existing UAL 0.5 checker does not implement this checking-context profile.",
    "version": "1.0.0",
    "authors": [
      "Plutus contributors"
    ],
    "created": "2026-09-29",
    "license": "Apache-2.0"
  },
  "blueprint": {
    "uri": "interface-game-blueprint.json",
    "hash": {
      "alg": "sha256",
      "digest": "27f985959bae0ef3a1ec3a5ebb12ceb78c987bf18a1510e54218d843c64a410c"
    },
    "mediaType": "application/json"
  },
  "languages": {
    "ual": {
      "name": "Universal Annotation Language",
      "description": "Property specification language used by Blaster.",
      "version": "1.0",
      "uri": "https://github.com/input-output-hk/UniversalAnnotationLanguage"
    }
  },
  "formalFragments": [
    {
      "id": "Main",
      "language": "ual",
      "source": "def hashMatches (actual guess : ByteString) : Prop :=\n  actual = PlutusCore.Crypto.Hash.sha2_256 guess"
    }
  ],
  "properties": [
    {
      "id": "correct_guess",
      "scope": {
        "validators": [
          "gameValidator"
        ]
      },
      "statement": {
        "text": "A guess whose hash matches the datum terminates successfully for every context.",
        "formal": {
          "language": "ual",
          "uses": [
            "Main"
          ],
          "source": "∀ (actual guess : ByteString) (ctx : Data), hashMatches actual guess →\n      isSuccessful (gameValidator (Data.B actual) (Data.B guess) ctx)"
        }
      },
      "checkingContext": "game-run"
    },
    {
      "id": "wrong_guess",
      "scope": {
        "validators": [
          "gameValidator"
        ]
      },
      "statement": {
        "text": "A guess whose hash differs from the datum fails script evaluation for every context.",
        "formal": {
          "language": "ual",
          "uses": [
            "Main"
          ],
          "source": "∀ (actual guess : ByteString) (ctx : Data), ¬ hashMatches actual guess →\n      isUnsuccessful (gameValidator (Data.B actual) (Data.B guess) ctx)"
        }
      },
      "checkingContext": "game-run"
    },
    {
      "id": "malformed_datum",
      "scope": {
        "validators": [
          "gameValidator"
        ]
      },
      "statement": {
        "text": "An integer datum fails to decode as the stored hash, for every redeemer and context.",
        "formal": {
          "language": "ual",
          "uses": [
            "Main"
          ],
          "source": "∀ (r ctx : Data), isUnsuccessful (gameValidator (Data.I 0) r ctx)"
        }
      },
      "checkingContext": "game-run"
    }
  ],
  "checkingContexts": {
    "game-run": {
      "uri": "game-checking.json",
      "hash": {
        "alg": "sha256",
        "digest": "3293b2f75ee7a69fce00acac01f8eb3e8582f3d9e6ba7d586e37da0270a08b4c"
      },
      "mediaType": "application/json"
    }
  }
}
